{
  "schema_version": "access-moppy.qc.v1",
  "model": "ACCESS-ESM1.6",
  "experiment_id": "amip",
  "variant_label": "r5i1p1f1",
  "checked_at": "2026-10-16T00:59:28+00:00",
  "checked_by": "sync_reports.py",
  "source_report": "moppy_batch_report_20261014T045014Z.json",
  "variables": {
    "atmos.areacella.ti-u-hxy-u.fx.glb": {
      "range": {
        "allowed": [
          0.0,
          100000000000.0
        ],
        "check_id": "cmip7_ranges",
        "observed": [
          79026785.62471725,
          28978280872.519714
        ],
        "result": "pass",
        "units": "m2"
      },
      "repack": {
        "message": "cmip7repack left areacella uncompressed (chunking contiguous, filters {'zlib': False, 'szip': False, 'zstd': False, 'bzip2': False, 'blosc': False, 'shuffle': False, 'complevel': 0, 'fletcher32': False})",
        "result": "warn",
        "tool": "cmip7repack"
      },
      "wcrp": {
        "check_id": "wcrp",
        "result": "pass",
        "suites": [
          "cf:1.11",
          "wcrp_cmip7:1.0"
        ],
        "cv_version": "2.3.4",
        "report_path": "/g/data/im55/admin/incoming/20260930/amip/amip-amip-1.0-r5i1p1f1-0273aa7c/logs/atmos_areacella_ti-u-hxy-u_fx_glb/compliance_areacella_ti-u-hxy-u_fx_glb_g115_ACCESS-ESM1-6_amip_r5i1p1f1.json",
        "backfilled": false,
        "checked_at": "2026-10-14T04:09:06+00:00"
      }
    },
    "land.mrsofc.ti-u-hxy-lnd.fx.glb": {
      "range": {
        "allowed": [
          0.0,
          10000.0
        ],
        "check_id": "cmip7_ranges",
        "observed": [
          0.0,
          1.1998010633792244
        ],
        "result": "pass",
        "units": "kg m-2"
      },
      "repack": {
        "message": "cmip7repack left mrsofc uncompressed (chunking contiguous, filters {'zlib': False, 'szip': False, 'zstd': False, 'bzip2': False, 'blosc': False, 'shuffle': False, 'complevel': 0, 'fletcher32': False})",
        "result": "warn",
        "tool": "cmip7repack"
      },
      "wcrp": {
        "check_id": "wcrp",
        "result": "pass",
        "suites": [
          "cf:1.11",
          "wcrp_cmip7:1.0"
        ],
        "cv_version": "2.3.4",
        "report_path": "/g/data/im55/admin/incoming/20260930/amip/amip-amip-1.0-r5i1p1f1-0273aa7c/logs/land_mrsofc_ti-u-hxy-lnd_fx_glb/compliance_mrsofc_ti-u-hxy-lnd_fx_glb_g115_ACCESS-ESM1-6_amip_r5i1p1f1.json",
        "backfilled": false,
        "checked_at": "2026-10-14T04:07:14+00:00"
      }
    },
    "land.orog.ti-u-hxy-u.fx.glb": {
      "range": {
        "allowed": [
          -500.0,
          9000.0
        ],
        "check_id": "cmip7_ranges",
        "observed": [
          -230.0431365966797,
          5499.869140625
        ],
        "result": "pass",
        "units": "m"
      },
      "repack": {
        "message": "cmip7repack left orog uncompressed (chunking contiguous, filters {'zlib': False, 'szip': False, 'zstd': False, 'bzip2': False, 'blosc': False, 'shuffle': False, 'complevel': 0, 'fletcher32': False})",
        "result": "warn",
        "tool": "cmip7repack"
      },
      "wcrp": {
        "check_id": "wcrp",
        "result": "pass",
        "suites": [
          "cf:1.11",
          "wcrp_cmip7:1.0"
        ],
        "cv_version": "2.3.4",
        "report_path": "/g/data/im55/admin/incoming/20260930/amip/amip-amip-1.0-r5i1p1f1-0273aa7c/logs/land_orog_ti-u-hxy-u_fx_glb/compliance_orog_ti-u-hxy-u_fx_glb_g115_ACCESS-ESM1-6_amip_r5i1p1f1.json",
        "backfilled": false,
        "checked_at": "2026-10-14T04:08:34+00:00"
      }
    },
    "land.rootd.ti-u-hxy-lnd.fx.glb": {
      "range": {
        "allowed": [
          0.0,
          20.0
        ],
        "check_id": "cmip7_ranges",
        "observed": [
          0.0,
          4.6
        ],
        "result": "pass",
        "units": "m"
      },
      "repack": {
        "message": "cmip7repack left rootd uncompressed (chunking contiguous, filters {'zlib': False, 'szip': False, 'zstd': False, 'bzip2': False, 'blosc': False, 'shuffle': False, 'complevel': 0, 'fletcher32': False})",
        "result": "warn",
        "tool": "cmip7repack"
      },
      "wcrp": {
        "check_id": "wcrp",
        "result": "pass",
        "suites": [
          "cf:1.11",
          "wcrp_cmip7:1.0"
        ],
        "cv_version": "2.3.4",
        "report_path": "/g/data/im55/admin/incoming/20260930/amip/amip-amip-1.0-r5i1p1f1-0273aa7c/logs/land_rootd_ti-u-hxy-lnd_fx_glb/compliance_rootd_ti-u-hxy-lnd_fx_glb_g115_ACCESS-ESM1-6_amip_r5i1p1f1.json",
        "backfilled": false,
        "checked_at": "2026-10-14T04:07:28+00:00"
      }
    },
    "land.sftgif.ti-u-hxy-u.fx.glb": {
      "range": {
        "allowed": [
          0.0,
          100.0
        ],
        "check_id": "cmip7_ranges",
        "observed": [
          0.0,
          100.0
        ],
        "result": "pass",
        "units": "%"
      },
      "repack": {
        "message": "cmip7repack left sftgif uncompressed (chunking contiguous, filters {'zlib': False, 'szip': False, 'zstd': False, 'bzip2': False, 'blosc': False, 'shuffle': False, 'complevel': 0, 'fletcher32': False})",
        "result": "warn",
        "tool": "cmip7repack"
      },
      "wcrp": {
        "check_id": "wcrp",
        "result": "pass",
        "suites": [
          "cf:1.11",
          "wcrp_cmip7:1.0"
        ],
        "cv_version": "2.3.4",
        "report_path": "/g/data/im55/admin/incoming/20260930/amip/amip-amip-1.0-r5i1p1f1-0273aa7c/logs/land_sftgif_ti-u-hxy-u_fx_glb/compliance_sftgif_ti-u-hxy-u_fx_glb_g115_ACCESS-ESM1-6_amip_r5i1p1f1.json",
        "backfilled": false,
        "checked_at": "2026-10-14T04:08:16+00:00"
      }
    },
    "atmos.sftlf.ti-u-hxy-u.fx.glb": {
      "range": {
        "allowed": [
          0.0,
          100.0
        ],
        "check_id": "cmip7_ranges",
        "observed": [
          0.0,
          100.0
        ],
        "result": "pass",
        "units": "%"
      },
      "repack": {
        "message": "cmip7repack left sftlf uncompressed (chunking contiguous, filters {'zlib': False, 'szip': False, 'zstd': False, 'bzip2': False, 'blosc': False, 'shuffle': False, 'complevel': 0, 'fletcher32': False})",
        "result": "warn",
        "tool": "cmip7repack"
      },
      "wcrp": {
        "check_id": "wcrp",
        "result": "pass",
        "suites": [
          "cf:1.11",
          "wcrp_cmip7:1.0"
        ],
        "cv_version": "2.3.4",
        "report_path": "/g/data/im55/admin/incoming/20260930/amip/amip-amip-1.0-r5i1p1f1-0273aa7c/logs/atmos_sftlf_ti-u-hxy-u_fx_glb/compliance_sftlf_ti-u-hxy-u_fx_glb_g115_ACCESS-ESM1-6_amip_r5i1p1f1.json",
        "backfilled": false,
        "checked_at": "2026-10-14T04:09:07+00:00"
      }
    },
    "land.slthick.ti-sl-hxy-lnd.fx.glb": {
      "range": {
        "allowed": [
          0.0,
          100.0
        ],
        "check_id": "cmip7_ranges",
        "observed": [
          0.0,
          2.871999979019165
        ],
        "result": "pass",
        "units": "m"
      },
      "repack": {
        "message": "cmip7repack left slthick uncompressed (chunking contiguous, filters {'zlib': False, 'szip': False, 'zstd': False, 'bzip2': False, 'blosc': False, 'shuffle': False, 'complevel': 0, 'fletcher32': False})",
        "result": "warn",
        "tool": "cmip7repack"
      },
      "wcrp": {
        "check_id": "wcrp",
        "result": "pass",
        "suites": [
          "cf:1.11",
          "wcrp_cmip7:1.0"
        ],
        "cv_version": "2.3.4",
        "report_path": "/g/data/im55/admin/incoming/20260930/amip/amip-amip-1.0-r5i1p1f1-0273aa7c/logs/land_slthick_ti-sl-hxy-lnd_fx_glb/compliance_slthick_ti-sl-hxy-lnd_fx_glb_g115_ACCESS-ESM1-6_amip_r5i1p1f1.json",
        "backfilled": false,
        "checked_at": "2026-10-14T04:09:02+00:00"
      }
    },
    "atmos.cl.tavg-al-hxy-u.mon.glb": {
      "range": {
        "allowed": [
          0.0,
          100.0
        ],
        "check_id": "cmip7_ranges",
        "observed": [
          0.0,
          99.9753646850586
        ],
        "result": "pass",
        "units": "%"
      },
      "repack": {
        "result": "pass",
        "tool": "cmip7repack"
      },
      "wcrp": {
        "check_id": "wcrp",
        "result": "pass",
        "suites": [
          "cf:1.11",
          "wcrp_cmip7:1.0"
        ],
        "cv_version": "2.3.4",
        "report_path": "/g/data/im55/admin/incoming/20260930/amip/amip-amip-1.0-r5i1p1f1-0273aa7c/logs/atmos_cl_tavg-al-hxy-u_mon_glb/compliance_cl_tavg-al-hxy-u_mon_glb_g115_ACCESS-ESM1-6_amip_r5i1p1f1_197901-197912.json",
        "backfilled": false,
        "checked_at": "2026-10-14T04:09:14+00:00"
      }
    },
    "atmos.cli.tavg-al-hxy-u.mon.glb": {
      "range": {
        "allowed": [
          0.0,
          0.02
        ],
        "check_id": "cmip7_ranges",
        "observed": [
          0.0,
          4.3803829612443224e-05
        ],
        "result": "pass",
        "units": "kg kg-1"
      },
      "repack": {
        "result": "pass",
        "tool": "cmip7repack"
      },
      "wcrp": {
        "check_id": "wcrp",
        "result": "pass",
        "suites": [
          "cf:1.11",
          "wcrp_cmip7:1.0"
        ],
        "cv_version": "2.3.4",
        "report_path": "/g/data/im55/admin/incoming/20260930/amip/amip-amip-1.0-r5i1p1f1-0273aa7c/logs/atmos_cli_tavg-al-hxy-u_mon_glb/compliance_cli_tavg-al-hxy-u_mon_glb_g115_ACCESS-ESM1-6_amip_r5i1p1f1_197901-197912.json",
        "backfilled": false,
        "checked_at": "2026-10-14T04:08:09+00:00"
      }
    },
    "atmos.clivi.tavg-u-hxy-u.mon.glb": {
      "range": {
        "allowed": [
          0.0,
          1000.0
        ],
        "check_id": "cmip7_ranges",
        "observed": [
          0.0,
          1.0680334568023682
        ],
        "result": "pass",
        "units": "kg m-2"
      },
      "repack": {
        "result": "pass",
        "tool": "cmip7repack"
      },